StitchID,StitchName,MultipleOf,StitchesPlus,SourceURL,Row #,Side,Repeat
1946,Very Narrow Edging 3,Multiple of 6 stitches,,https://www.knittingfool.com/StitchIndex/StitchDetail.aspx?StitchID=1946,1,R,"Yo, p2-tog, k2, yo twice, k2"
1946,Very Narrow Edging 3,Multiple of 6 stitches,,https://www.knittingfool.com/StitchIndex/StitchDetail.aspx?StitchID=1946,2,W,"k2, (k1, p1) in double yarn over loop, k2, yo, p2-tog."
1946,Very Narrow Edging 3,Multiple of 6 stitches,,https://www.knittingfool.com/StitchIndex/StitchDetail.aspx?StitchID=1946,3,R,"Yo, p2-tog, k2, yo twice, k2-tog, yo twice, k2."
1946,Very Narrow Edging 3,Multiple of 6 stitches,,https://www.knittingfool.com/StitchIndex/StitchDetail.aspx?StitchID=1946,4,W,"K2, (k1, p1) in double yarn over loop, k1, (k1, p1) in double yarn over loop, k2, yo, p2-tog."
1946,Very Narrow Edging 3,Multiple of 6 stitches,,https://www.knittingfool.com/StitchIndex/StitchDetail.aspx?StitchID=1946,5,R,"Yo, p2-tog, k9."
1946,Very Narrow Edging 3,Multiple of 6 stitches,,https://www.knittingfool.com/StitchIndex/StitchDetail.aspx?StitchID=1946,6,W,"Bind off 5 stitches, k3, yo, p2-tog."
