StitchID,StitchName,MultipleOf,StitchesPlus,SourceURL,Row #,Side,Repeat
1965,Pointed Scallops,Multiple of 11 stitches,,https://www.knittingfool.com/StitchIndex/StitchDetail.aspx?StitchID=1965,1,R,"Sl 1, k2, yo, k2-tog, (yo, k1) twice, k2-tog, yo twice, k2-tog"
1965,Pointed Scallops,Multiple of 11 stitches,,https://www.knittingfool.com/StitchIndex/StitchDetail.aspx?StitchID=1965,2,W,"K2, p1, k7, yo, k2-tog, k1"
1965,Pointed Scallops,Multiple of 11 stitches,,https://www.knittingfool.com/StitchIndex/StitchDetail.aspx?StitchID=1965,3,R,"Sl 1, k2, yo, k2-tog, yo, k2, yo, k1, k2-tog, yo twice, k2-tog, k1"
1965,Pointed Scallops,Multiple of 11 stitches,,https://www.knittingfool.com/StitchIndex/StitchDetail.aspx?StitchID=1965,4,W,"K3, p1, k8, yo, k2-tog, k1"
1965,Pointed Scallops,Multiple of 11 stitches,,https://www.knittingfool.com/StitchIndex/StitchDetail.aspx?StitchID=1965,5,R,"Sl 1, k2, yo, k2-tog, yo, k3, yo, k1, (k2-tog, yo twice) twice, k2-tog"
1965,Pointed Scallops,Multiple of 11 stitches,,https://www.knittingfool.com/StitchIndex/StitchDetail.aspx?StitchID=1965,6,W,"(K2, p1) twice, k9, yo, k2-tog, k1"
1965,Pointed Scallops,Multiple of 11 stitches,,https://www.knittingfool.com/StitchIndex/StitchDetail.aspx?StitchID=1965,7,R,"Sl 1, k2, yo, k2-tog, yo, sl 1-k2-tog-psso, yo, k1, k2-tog, k7"
1965,Pointed Scallops,Multiple of 11 stitches,,https://www.knittingfool.com/StitchIndex/StitchDetail.aspx?StitchID=1965,8,W,"Bind up 6 stitches, k7, yo, k2-tog, k1"
